{
  "id": "mesh-status-pill",
  "name": "MS / Status / MeshStatusPill",
  "category": "Status",
  "interactive": false,
  "variants": ["connected", "offline", "paused", "degraded"],
  "states": ["default"],
  "a11y": { "role": "status", "minTarget": "target.pointer", "focusVisible": false, "labelRequired": true },
  "tokens": {
    "connected": "color.state.success",
    "degraded": "color.state.warning",
    "offline": "role.deviceState.offline",
    "label": "color.text.primary",
    "radius": "radius.full"
  },
  "platforms": {
    "web": "MeshStatusPill (React)",
    "ios": "MeshStatusPill (SwiftUI View)",
    "android": "MeshStatusPill (Compose)",
    "macos": "MeshStatusPill (SwiftUI View)",
    "windows": "MeshStatusPill (UserControl)"
  },
  "journeys": ["J-003", "J-005"],
  "readiness": "L2"
}
